[
  {
    "slug": "seo-geo-audit",
    "name": "SEO / GEO Audit Agent",
    "category": "Digital Marketing",
    "task_type": "seo_audit",
    "archetype": "consulting_agent",
    "automation_level": "L4",
    "risk_level": "medium",
    "deliverable_types": ["audit_report", "prioritized_backlog", "keyword_gap_table"],
    "api_providers": ["openai_responses", "browser_search", "google_ads"],
    "brief_fields": ["website_url", "target_market", "target_keywords", "competitors", "cms", "business_goal"],
    "output_fields": ["executive_summary", "technical_findings", "content_findings", "geo_findings", "backlog", "evidence_links"],
    "qa_checks": ["evidence_links_resolve", "recommendations_are_prioritized", "no_ad_spend_without_authorization"],
    "policy_rules": ["No guaranteed ranking claims.", "Paid campaign actions require explicit authorization."],
    "golden_samples": ["local_business_site_audit", "saas_geo_visibility_audit"]
  },
  {
    "slug": "blog-article-writer",
    "name": "Blog & Article Writer Agent",
    "category": "Writing & Translation",
    "task_type": "writing",
    "archetype": "content_agent",
    "automation_level": "L5",
    "risk_level": "low",
    "deliverable_types": ["article_doc", "outline", "meta_title_description"],
    "api_providers": ["openai_responses", "browser_search"],
    "brief_fields": ["topic", "audience", "tone", "target_length", "keywords", "source_links", "brand_voice"],
    "output_fields": ["outline", "draft", "citations", "seo_metadata", "revision_notes"],
    "qa_checks": ["brief_keywords_used_naturally", "unsupported_claims_flagged", "style_matches_brief"],
    "policy_rules": ["Do not fabricate citations.", "Medical, legal, financial advice must be framed as general information."],
    "golden_samples": ["saas_blog_post", "founder_opinion_piece"]
  },
  {
    "slug": "resume-linkedin-profile",
    "name": "Resume / LinkedIn Profile Agent",
    "category": "Writing & Translation",
    "task_type": "career_writing",
    "archetype": "content_agent",
    "automation_level": "L5",
    "risk_level": "low",
    "deliverable_types": ["resume_doc", "linkedin_profile", "cover_letter"],
    "api_providers": ["openai_responses"],
    "brief_fields": ["current_resume", "target_roles", "career_level", "achievements", "constraints", "preferred_format"],
    "output_fields": ["resume", "linkedin_headline", "about_section", "experience_bullets", "ats_keywords"],
    "qa_checks": ["no_invented_experience", "metrics_preserved_or_marked_as_placeholders", "ats_keywords_relevant"],
    "policy_rules": ["Do not fabricate credentials, employers, degrees, or metrics."],
    "golden_samples": ["product_manager_resume", "software_engineer_linkedin"]
  },
  {
    "slug": "translation-localization",
    "name": "Translation & Localization Agent",
    "category": "Writing & Translation",
    "task_type": "translation",
    "archetype": "content_agent",
    "automation_level": "L5",
    "risk_level": "low",
    "deliverable_types": ["translated_doc", "localization_notes", "glossary"],
    "api_providers": ["openai_responses"],
    "brief_fields": ["source_text", "source_language", "target_language", "locale", "tone", "glossary", "do_not_translate_terms"],
    "output_fields": ["translation", "glossary_used", "cultural_notes", "uncertain_terms"],
    "qa_checks": ["do_not_translate_terms_preserved", "locale_specific_terms_checked", "format_preserved"],
    "policy_rules": ["Certified/legal/medical translations require human-certified review."],
    "golden_samples": ["marketing_page_en_to_zh", "app_strings_zh_to_en"]
  },
  {
    "slug": "social-media-calendar",
    "name": "Social Media Calendar Agent",
    "category": "Digital Marketing",
    "task_type": "social_calendar",
    "archetype": "content_agent",
    "automation_level": "L4",
    "risk_level": "medium",
    "deliverable_types": ["calendar_table", "post_copy", "creative_briefs"],
    "api_providers": ["openai_responses", "banana", "gpt_image_2"],
    "brief_fields": ["brand", "channels", "posting_frequency", "campaign_goal", "audience", "offer", "brand_assets"],
    "output_fields": ["calendar", "copy_variants", "creative_prompts", "hashtags", "approval_status"],
    "qa_checks": ["channel_lengths_checked", "brand_voice_consistent", "publication_requires_authorization"],
    "policy_rules": ["No posting to social accounts without explicit authorization."],
    "golden_samples": ["b2b_linkedin_month", "ecommerce_instagram_week"]
  },
  {
    "slug": "email-marketing-copy",
    "name": "Email Marketing Copy Agent",
    "category": "Digital Marketing",
    "task_type": "email_copy",
    "archetype": "content_agent",
    "automation_level": "L4",
    "risk_level": "medium",
    "deliverable_types": ["email_sequence", "subject_lines", "ab_test_plan"],
    "api_providers": ["openai_responses"],
    "brief_fields": ["audience", "offer", "funnel_stage", "brand_voice", "compliance_constraints", "cta"],
    "output_fields": ["sequence", "subject_lines", "preview_text", "cta", "test_hypotheses"],
    "qa_checks": ["spam_trigger_reviewed", "unsubscribe_and_claims_policy_checked", "send_requires_authorization"],
    "policy_rules": ["No bulk sending without authorization and compliance review."],
    "golden_samples": ["welcome_sequence", "product_launch_sequence"]
  },
  {
    "slug": "landing-page-copy-wireframe",
    "name": "Landing Page Copy + Wireframe Agent",
    "category": "Writing & Translation",
    "task_type": "landing_page",
    "archetype": "content_agent",
    "automation_level": "L4",
    "risk_level": "medium",
    "deliverable_types": ["page_copy", "wireframe", "section_spec"],
    "api_providers": ["openai_responses", "gpt_image_2", "vercel"],
    "brief_fields": ["product", "audience", "offer", "proof_points", "competitors", "brand_assets", "conversion_goal"],
    "output_fields": ["hero", "sections", "cta", "wireframe_notes", "asset_prompts"],
    "qa_checks": ["claims_have_sources_or_placeholders", "mobile_sections_defined", "deploy_requires_authorization"],
    "policy_rules": ["No deceptive claims or fake testimonials."],
    "golden_samples": ["saas_waitlist_page", "course_sales_page"]
  },
  {
    "slug": "presentation-pitch-deck",
    "name": "Presentation / Pitch Deck Agent",
    "category": "Business",
    "task_type": "presentation",
    "archetype": "consulting_agent",
    "automation_level": "L4",
    "risk_level": "medium",
    "deliverable_types": ["deck_outline", "pptx", "speaker_notes"],
    "api_providers": ["openai_responses", "gpt_image_2"],
    "brief_fields": ["deck_goal", "audience", "source_materials", "brand_assets", "slide_count", "format"],
    "output_fields": ["narrative", "slides", "speaker_notes", "design_notes", "open_questions"],
    "qa_checks": ["storyline_coherent", "slide_density_checked", "financial_claims_flagged"],
    "policy_rules": ["Investor claims and projections must identify assumptions."],
    "golden_samples": ["seed_pitch_deck", "sales_deck"]
  },
  {
    "slug": "market-research-brief",
    "name": "Market Research Brief Agent",
    "category": "Business",
    "task_type": "market_research",
    "archetype": "consulting_agent",
    "automation_level": "L4",
    "risk_level": "medium",
    "deliverable_types": ["research_report", "competitor_table", "source_log"],
    "api_providers": ["openai_responses", "browser_search"],
    "brief_fields": ["market", "region", "customer_segment", "questions", "competitors", "time_horizon"],
    "output_fields": ["summary", "market_map", "competitors", "trends", "sources", "limitations"],
    "qa_checks": ["sources_recent_enough", "claims_have_sources", "limitations_explicit"],
    "policy_rules": ["Forecasts must be labeled as estimates, not facts."],
    "golden_samples": ["ai_tool_market_scan", "local_service_competitor_scan"]
  },
  {
    "slug": "data-cleaning-formatting",
    "name": "Data Cleaning & Formatting Agent",
    "category": "Data",
    "task_type": "data_cleaning",
    "archetype": "data_agent",
    "automation_level": "L5",
    "risk_level": "low",
    "deliverable_types": ["clean_csv", "data_dictionary", "cleaning_report"],
    "api_providers": ["openai_responses"],
    "brief_fields": ["dataset_file", "target_schema", "dedupe_rules", "missing_value_rules", "output_format"],
    "output_fields": ["cleaned_dataset", "change_log", "row_counts", "data_dictionary", "quality_warnings"],
    "qa_checks": ["row_counts_reconciled", "schema_validated", "sample_rows_reviewed"],
    "policy_rules": ["PII must be detected and handled according to buyer instruction."],
    "golden_samples": ["crm_contacts_cleanup", "product_catalog_normalization"]
  },
  {
    "slug": "data-scraping-enrichment",
    "name": "Data Scraping + Enrichment Agent",
    "category": "Data",
    "task_type": "scraping",
    "archetype": "data_agent",
    "automation_level": "L3",
    "risk_level": "medium",
    "deliverable_types": ["dataset", "scraper_plan", "source_log"],
    "api_providers": ["openai_responses", "browser_search"],
    "brief_fields": ["target_sources", "fields", "volume", "refresh_frequency", "allowed_methods", "compliance_constraints"],
    "output_fields": ["dataset", "source_log", "method_notes", "blocked_sources", "quality_report"],
    "qa_checks": ["robots_terms_reviewed", "sample_accuracy_checked", "provenance_recorded"],
    "policy_rules": ["Do not bypass access controls or scrape disallowed personal data."],
    "golden_samples": ["public_directory_enrichment", "competitor_pricing_sample"]
  },
  {
    "slug": "dashboard-prototype",
    "name": "Dashboard Prototype Agent",
    "category": "Data",
    "task_type": "dashboard",
    "archetype": "data_agent",
    "automation_level": "L4",
    "risk_level": "low",
    "deliverable_types": ["dashboard_mock", "metric_spec", "sample_dataset"],
    "api_providers": ["openai_responses"],